{"adopted_for_execution":false,"bindings":[{"file_sha256":"e01626eef5afa484089cbe96b59855eea98679519c5fd3eefa3ddc42f2e5bafc","uri":"control/budgets/a1.2-common-screen-scientific-request-v11.json"},{"file_sha256":"2f7d70d708909e8c6c946ab2e03c62e6246222fcb0333bdee44997fb24020b4b","uri":"control/owner-local/a1.2-evaluator-handoff-request.v11.json"},{"file_sha256":"21e4d9913056968cdf314382c12812ff8f4b1f01586c82294765a0ebd2a4777a","uri":"control/armindex/a1.2/scientific-transfer-contract.v11.json"},{"file_sha256":"6bda78e024465944135ff6dff0883af37c86c31b9f004e01a195663467a527aa","uri":"control/armindex/a1.2/common-program-set.v11.json"},{"file_sha256":"e0e29bfa15286977d865679200dd3a8d66ec852f4239780f60226b5b9eea2c4b","uri":"control/armindex/a1.2/aggregate-result-contract.v11.json"},{"file_sha256":"31135d2f1813730a346e7ef0046314b69610ddd9884a913911c27589d6fcbf92","uri":"schemas/armindex/a1.2-aggregate-result-receipt.v11.json"},{"file_sha256":"c892e2fcbc918444f911b120775cd049360dc812f6e11e871e03a43c98df45cd","uri":"src/myis_research/armindex/scientific_common_programs_v11.py"},{"file_sha256":"8a46db96a95d0f61caeb9fb2cd052daf07b35acdcf592a11e2336e17c88597d7","uri":"control/armindex/a1.2/stop-conditions.scientific-request.v11.json"},{"file_sha256":"a41392aa33fbaf6e376a2aa6ff02dbf6e49053876affa7a27cc3820a12793594","uri":"control/armindex/a1.2/provider-admission-plan.v11.json"},{"file_sha256":"a838b19794c05b08a5b9f4efb3aef5805f5a174a37e92c5a9111b16a9e8b91fb","uri":"control/armindex/a1.2/workload-manifest-set.scientific-request.v11.json"},{"file_sha256":"d5eaec8bf7c78ec9a21f43a5f94f89ccc314eef79bad9b0e7629a1a7e902851d","uri":"control/armindex/a1.2/scientific-execution-adoption-request.v11.json"},{"file_sha256":"d7fa396ec01ba4b4b4ee1506fd4eb5e5539b9555f518ed986d195accc811211e","uri":"schemas/armindex/a1.2-scientific-execution-adoption-request.v11.json"},{"file_sha256":"a02666bbeed4043c70b9b2cf1e1462b10ce2f2bbdb486f4afd7c033ebeb27977","uri":"schemas/armindex/a1.2-scientific-execution-adoption-request-receipt.v11.json"},{"file_sha256":"b2c7d4d7d45d2fca4d7c78272c2a57c68cb78c4bab0630db17b6a8a357436a09","uri":"docs/operations/A1_2_SCIENTIFIC_EXECUTION_ADOPTION_REQUEST_V11.md"}],"charged_usd":0,"claim_boundary":"Local CPU-only preparation of a future A1.2 measured common-screen request; no provider contact, adoption, measured retrieval, optimization, Selection, Final, paid API work, model change, retrieval-quality result, or publication claim.","evidence_class":"scientific_execution_adoption_request_preparation","final_accesses":0,"launch_allowed":false,"ledger":{"append_only":true,"start_entry_sha256":"52589c23c0e4d1cb1737d5d7935215746b8fc17a19b3aaade6d12dca9d3f08f0","uri":"control/armindex/a1.2/scientific-execution-adoption-request-ledger.v11.jsonl"},"measured_runs":0,"next_authorized_action":"Owner reviews the unchanged v11 request locally. A separate goal may prepare an adoption receipt only after a clean pushed execution commit/tree, Owner-local protected handoff and transfer receipts, 25 validated compiled-program bindings, fresh provider identity and all-fee quote, whole-workload budget admission, and watchdog/destroy checks are available; do not open a provider during this preparation goal.","pending_adoption_requirements":["unchanged_v11_request_hash","clean_pushed_execution_commit_tree_and_bundle_hash","owner_local_protected_handoff_receipt","owner_local_protected_transfer_manifest","twenty_five_valid_compiled_program_bindings","fresh_provider_identity_and_live_quote","whole_workload_budget_admission","owner_local_watchdog_and_provider_destroy_dry_run","separate_owner_authorized_adoption_goal"],"receipt_id":"a1.2-scientific-execution-adoption-request-v11","receipt_sha256":"6de14783873a8405d67a21236252a0d93269601b494366b686fe348ac7308bc2","request":{"file_sha256":"d5eaec8bf7c78ec9a21f43a5f94f89ccc314eef79bad9b0e7629a1a7e902851d","request_sha256":"2e95bf70d4843dadac03b442cb231573f73ec05a65884a70ac42d9713f52b7db","uri":"control/armindex/a1.2/scientific-execution-adoption-request.v11.json"},"revision_id":"a1.2-scientific-execution-adoption-request-v11","schema_version":"myis.armindex-a1.2-scientific-execution-adoption-request-receipt.v11","scientific_authority":false,"selection_accesses":0,"status":"PASS","validation_summary":{"common_programs":5,"expected_physical_program_view_paths":35,"expected_program_arm_runs":25,"harness_dev_reserved_count":100,"lineage_bindings":11,"operational_bindings":7,"protected_payload_opened":false,"provider_contacted":false,"rep_dev_query_count":150,"required_aggregate_result_receipts":25,"workload_manifests":5}}
